[
  {
    "id": "kitem-7cea59eed8",
    "knowledge_id": "kitem-7cea59eed8",
    "title": "李明的快速会议",
    "governance_layer": "治理层",
    "material_type": "knowledge_source_root",
    "source_system": "tencent_meeting",
    "source_ref": "https://meeting.tencent.com/cw/NgPG5mpz31",
    "source_id": "NgPG5mpz31",
    "canonical_path": "/Users/hay2045/Documents/codex-ai-gua-jia-01/output/tencent-meeting/ngpg5mpz31/source.md",
    "summary": "Knowledge source seed for 李明的快速会议. Validation status: validated.",
    "importance": "high",
    "sync_tier": "core",
    "status": "active",
    "updated_at": "2026-03-11T10:44:55+08:00"
  },
  {
    "id": "kitem-2e8b432c2f",
    "knowledge_id": "kitem-2e8b432c2f",
    "title": "【原力龙虾】",
    "governance_layer": "治理层",
    "material_type": "knowledge_source_root",
    "source_system": "feishu",
    "source_ref": "https://h52xu4gwob.feishu.cn/wiki/Es2BwdUAmi3Swxk8kYQcvJgmnM7",
    "source_id": "ksrc-b9adca5b1d",
    "canonical_path": "/Users/hay2045/Documents/codex-ai-gua-jia-01/output/feishu-reader/yuanli-planet-shared/source.md",
    "summary": "Knowledge source seed for 【原力龙虾】. Validation status: validated.",
    "importance": "high",
    "sync_tier": "core",
    "status": "active",
    "updated_at": "2026-03-11T10:40:17+08:00"
  },
  {
    "id": "kitem-c45c3cef2c",
    "knowledge_id": "kitem-c45c3cef2c",
    "title": "原力OS",
    "governance_layer": "治理层",
    "material_type": "operating_system_map",
    "source_system": "feishu",
    "source_ref": "manual_nav::【原力龙虾】/原力OS",
    "source_id": "ksrc-b9adca5b1d",
    "canonical_path": "/Users/hay2045/Documents/codex-ai-gua-jia-01/output/feishu-reader/yuanli-planet-shared/source.md",
    "summary": "Top-level operating system map for the Yuanli knowledge space.",
    "importance": "high",
    "sync_tier": "core",
    "status": "active",
    "updated_at": "2026-03-11T10:46:48+08:00"
  },
  {
    "id": "kitem-66d3246865",
    "knowledge_id": "kitem-66d3246865",
    "title": "SOUL-递归日志-AI管家",
    "governance_layer": "线程层",
    "material_type": "recursive_log",
    "source_system": "feishu",
    "source_ref": "manual_nav::【原力龙虾】/SOUL-递归日志-AI管家",
    "source_id": "ksrc-b9adca5b1d",
    "canonical_path": "/Users/hay2045/Documents/codex-ai-gua-jia-01/output/feishu-reader/yuanli-planet-shared/source.md",
    "summary": "Active recursive work log for AI大管家 collaboration and governance evolution.",
    "importance": "high",
    "sync_tier": "candidate",
    "status": "active",
    "updated_at": "2026-03-11T10:46:48+08:00"
  },
  {
    "id": "kitem-0c486d71b6",
    "knowledge_id": "kitem-0c486d71b6",
    "title": "SOUL-递归日志-AI灵兽",
    "governance_layer": "线程层",
    "material_type": "recursive_log",
    "source_system": "feishu",
    "source_ref": "manual_nav::【原力龙虾】/SOUL-递归日志-AI灵兽",
    "source_id": "ksrc-b9adca5b1d",
    "canonical_path": "/Users/hay2045/Documents/codex-ai-gua-jia-01/output/feishu-reader/yuanli-planet-shared/source.md",
    "summary": "Active recursive work log for AI灵兽 co-evolution threads.",
    "importance": "medium",
    "sync_tier": "candidate",
    "status": "active",
    "updated_at": "2026-03-11T10:46:48+08:00"
  },
  {
    "id": "kitem-95b354564e",
    "knowledge_id": "kitem-95b354564e",
    "title": "驯兽日志",
    "governance_layer": "线程层",
    "material_type": "training_log",
    "source_system": "feishu",
    "source_ref": "manual_nav::【原力龙虾】/驯兽日志",
    "source_id": "ksrc-b9adca5b1d",
    "canonical_path": "/Users/hay2045/Documents/codex-ai-gua-jia-01/output/feishu-reader/yuanli-planet-shared/source.md",
    "summary": "Operational training log for agent behavior tuning and observations.",
    "importance": "medium",
    "sync_tier": "candidate",
    "status": "active",
    "updated_at": "2026-03-11T10:46:48+08:00"
  },
  {
    "id": "kitem-c6275e0a88",
    "knowledge_id": "kitem-c6275e0a88",
    "title": "技能盘点",
    "governance_layer": "资产层",
    "material_type": "skill_inventory",
    "source_system": "feishu",
    "source_ref": "manual_nav::【原力龙虾】/技能盘点",
    "source_id": "ksrc-b9adca5b1d",
    "canonical_path": "/Users/hay2045/Documents/codex-ai-gua-jia-01/output/feishu-reader/yuanli-planet-shared/source.md",
    "summary": "Reusable skill inventory and capability map for Yuanli collaboration.",
    "importance": "high",
    "sync_tier": "core",
    "status": "active",
    "updated_at": "2026-03-11T10:46:48+08:00"
  }
]
